{
  "schema_version": "3.0.0",
  "event_id": "evt-v3-407fdd0d26ef9925d6a78880d03fba36e9d850a50969f4c87f42866bccc4ae66",
  "identity_inputs_sha256": "407fdd0d26ef9925d6a78880d03fba36e9d850a50969f4c87f42866bccc4ae66",
  "run_manifest_id": "run-v3-aaaaaaaaaaaaaaaaaaaaaaaaaaaaaaaaaaaaaaaaaaaaaaaaaaaaaaaaaaaaaaaa",
  "run_manifest_sha256": "bbbbbbbbbbbbbbbbbbbbbbbbbbbbbbbbbbbbbbbbbbbbbbbbbbbbbbbbbbbbbbbb",
  "identity_basis": {
    "kind": "origin",
    "first_observation_id": "obs-v3-3db6deec69f88dc301cd7c2e06547d6349080a5182f291229ed4e73d3a976c13",
    "parent_event_ids": [],
    "trigger_observation_ids": [
      "obs-v3-3db6deec69f88dc301cd7c2e06547d6349080a5182f291229ed4e73d3a976c13"
    ]
  },
  "monitoring_extent_id": "araripe-implementation-rectangle-v1",
  "status": "superseded",
  "first_observed_on": "2026-04-07",
  "last_observed_on": "2026-04-07",
  "observation_dates": [
    "2026-04-07"
  ],
  "n_distinct_observation_dates": 1,
  "observation_ids": [
    "obs-v3-3db6deec69f88dc301cd7c2e06547d6349080a5182f291229ed4e73d3a976c13"
  ],
  "acquisition_ids": [
    "acq-v3-dcb7dafaee610620b685a4cf0a06e541da32e25593a8c0b8a8e1a0c585b9259a"
  ],
  "contribution_keys": [
    "pc-v3-541d6c9b2e1efc03de4652e3fcfec7d8fa5cb91e5a5e4d8ae6af26420ba23dcc"
  ],
  "incoming_lineage_ids": [],
  "outgoing_lineage_ids": [
    "lin-v3-6015cb09ebc3edc873ba9891bc0810618c73c1e9a64a0ecef559966ec1c005fb"
  ],
  "representative_geometry_crs": "EPSG:4326",
  "representative_geometry": {
    "type": "Polygon",
    "coordinates": [
      [
        [
          -40.0,
          -7.1
        ],
        [
          -39.9,
          -7.1
        ],
        [
          -39.9,
          -7.0
        ],
        [
          -40.0,
          -7.0
        ],
        [
          -40.0,
          -7.1
        ]
      ]
    ]
  },
  "representative_geometry_sha256": "ce0b0669f9f217872ff550ace3440e4a4cbc9a609738574852fc045e910e6bee",
  "raw_observations_preserved": true,
  "persistence_tier": "first_observation",
  "created_at": "2026-04-07T14:00:00Z",
  "updated_at": "2026-04-07T14:00:00Z"
}
